ID,Name,TypeofLMI,LMIName,Description,Location,TargetAudience,Access,UpdateFrequency,InformationDepth,ReleaseDate,SegmentSpecific
272,"Innovation, Science and Economic Development Canada",research,International Mobility of Highly Skilled Workers: A Synthesis of Key Findings and Policy Implications,"Highly skilled labour is an essential input to an innovative economy. In recent decades, highly skilled workers have become more mobile internationally. Furthermore, high demand for skills in industrialized countries has led to intense international competition for these mobile workers. Immigration and emigration, either temporary or permanent, of highly skilled workers can help provide Canada with people with needed skills; but if Canada's overall attractiveness to these workers is insufficient, they will go elsewhere. Canada needs to adjust to new skills requirements and global skills competition in order to support a more innovative knowledge-based economy. An essential element of this adjustment is to increase Canada's ability to attract and retain highly skilled workers. The chief issue challenging policymakers is how to structure policy responses to benefit from the international mobility of highly skilled workers, taking into consideration the variety of ways the mobility of the highly skilled affects the domestic labour market and the economy. The aim of this synthesis report is to support policy development by drawing on the research findings from the projects conducted under the Skills Research Initiative (SRI) supplemented by other research.",https://www.ic.gc.ca/eic/site/eas-aes.nsf/vwapj/SRIsr04.pdf/$FILE/SRIsr04.pdf,,Open,NA,National,2008,Any / All
307,Massage Therapists Association of Nova Scotia,products,Massage Therapists Association of Nova Scotia,"MTANS is a self governing body of massage therapists and is dedicated to protecting the public, serving its members, and promoting the highest possible quality of the practice of massage therapy.",https://www.mtans.ca/,,Restricted,,Provincial,,Any / All
273,"Innovation, Science and Economic Development Canada",research,The Labour Market and Skill Implications of Population Aging in Canada: A Synthesis of Key Findings,"The Canadian population is aging. Population aging will affect Canada's ability to provide the talent and skills needed to build an increasingly innovative and productive knowledge-based economy; and population aging will have a wide range of labour market impacts beyond its effects on skills. Policy responses to the skills and labour market effects of population aging require knowledge of these effects, but there are important knowledge gaps. To address these gaps, the Skills Research Initiative (SRI) identified ""Skills and Labour Market Implications of Population Aging in Canada"" as one of its four research themes. The SRI research projects on this theme are now completed. This synthesis report discusses the knowledge they have generated and its implications for policy.",https://www.ic.gc.ca/eic/site/eas-aes.nsf/vwapj/SRIsr02.pdf/$FILE/SRIsr02.pdf,,Open,NA,National,2008,Any / All
274,"Innovation, Science and Economic Development Canada",research,Adjustments in Markets for Skilled Workers in Canada: A Synthesis of Key Findings and Policy Implications,"Canada is committed to building a more innovative, more productive knowledge-based economy. A key part of this commitment is to ensure that the talent and skills required are available. The Skills Research Initiative (SRI) is a medium-term policy research",https://www.ic.gc.ca/eic/site/eas-aes.nsf/vwapj/SRIsr03.pdf/$FILE/SRIsr03.pdf,,Open,NA,National,2008,Any / All
275,Information and Communications Technology Council,products,Information and Communications Technology Council,"The Information and Communications Technology Council (ICTC) is a centre of expertise in Information and Communications Technology (ICT) research, policy development, and workforce solutions.  ICTC enables industries to maintain a competitive advantage in a global market and develop Canada's future skilled and innovative talent.",http://www.ictc-ctic.ca/,,Restricted,,Regional,,immigrant
276,"Installation, Maintenance and Repair Sector Council",products,Installation Maintenance and Repair Sector Council (IMR),"IMR carries out activities that contribute to the building of strong businesses, development of qualified workers, labour market information, regulations and standards, best practices for the purpose of improving the quality of service and the public image of the service industry within Canada.",http://www.imrsectorcouncil.ca/,,OPEN,,Regional,,immigrant
278,Insurance Brokers Association of Nova Scotia,products,Insurance Brokers of Nova Scotia,"IBANS is a member of the Insurance Brokers Association of Canada (IBAC), a national trade organization, that brings together 11 provincial associations of Property and Casualty (P&C) insurance brokers in Canada.",http://www.ibans.com,,OPEN,,Provincial,,immigrant
279,Investment Property Owners Association of Nova Scotia Limited,products,(IPOANS) Investment Property Owners Association of Nova Scotia Limited,IPOANS is an organization dedicated to representing the interests of private residential property owners in the province and providing members with services of substantial benefit.,http://www.ipoans.ca/,,OPEN,,Provincial,,Any / All
297,Department of Labour and Advanced Education,products,Labour Force Survey,Monthly update on Labour Force Survey.,https://explorecareers.novascotia.ca/ns-labourmarket,,Open,,Monthly,,NA
313,Nova Scotia Association of Architects,products,Nova Scotia Association of Architects,The Nova Scotia Association of Architects is a professional organization formed to administer and direct the practice of architecture in the Province of Nova Scotia.,http://www.nsaa.ns.ca/,,Restricted,,Provincial,,Any / All
280,ISANS,research,Adult Immigrant Learning Needs in Atlantic Canadian Communities: Report on a Series of Community Knowledge-Exchange Meetings,This is a report on a series of four knowledge exchange meetings in each of the Atlantic Canadian Provinces organized by HILC and the Adult Learning Knowledge Centre's Community Connections Working Group.  These meetings were aimed at identifying the particular learning needs of adult immigrants within Atlantic Canada.  The meetings were designed to provide participants with an open and candid discussion forum in which they could describe their experiences with and issues around adult learning since their immigration to Canada.  Issues included access to educational opportunities and employment.,http://www.ccl-cca.ca,,Restricted,NA,Regional,2008,Any / All
281,ISANS,research,Going the Distance: A Framework for Providing Distance Services in Nova Scotia,"Work in Nova Scotia (WINS) is a bridging program designed to facilitate the integration of newcomers into the provincial workforce. This report describes the WINS distance program and, according to the report, the goals of the program were to integrate the appropriate use of technology into effective delivery of programs and services for newcomers in Nova Scotia that supports convenience, high quality learning and customization to clients, and to use appropriate technology to maximize access and minimize barriers to HILC and MISA programs and services for all Nova Scotian newcomers.",http://www.isans.ca,,Restricted,NA,Provincial,2008,Any / All
282,ISANS,research,Integrating International Medical Graduates: Nova Scotia Resources & Gaps,This paper aims to analyze and synthesize information on the resources and gaps in the IMG licensing process in Nova Scotia and provide recommendations to the province to ensure a fair and effective process for their integration in the health care system and support this group in their journey to be licensed.,http://www.isans.ca,,Restricted,NA,Provincial,2009,Any / All
283,ISANS,research,Senior Immigrants Needs and Assets Assessment,"Immigrant Settlement and Integration Services (ISIS) conducted a Needs and Assets Assessment of senior immigrants ages 55 years and over in the Halifax Regional Municipality (HRM). The report includes information on labour shortages, aging population, employment opportunities, and the role of seniors and senior immigrants.",http://www.isans.ca,,Restricted,NA,Municipal,2010,Any / All
304,Maritime Provinces Higher Education Commission,research,Intentions of University Graduates,"More than 12,000 Maritime university students were in their final weeks of a bachelor's degree in late March 2007. New Brunswick, Nova Scotia and Prince Edward Island, under the Council of Atlantic Ministers of Education and Training, together with the Maritime Provinces Higher Education Commission and the Canadian Council on Learning, joined in a partnership, with cooperation from the region's universities, to conduct a survey of these students in order to gain insight into attitudes toward, and plans for, pursuing further education, as well as preparedness for further studies and the workforce. The study also provides important information on student debt at graduation.",http://www.mphec.ca/research/IntentionsUniversityGraduates.aspx,,Open,NA,Industry,2008,Any / All
284,ISANS,research,New Beginnings Online - Pre-Pilot Project,"This report is a description of a project. The project entailed offering an online or distance series of pre- employment workshops to participants from China, India and the Philippines intending to emigrate to Canada. The purpose of the online workshops was to facilitate the labour market integration of newcomers anywhere in Canada. The aim of the New Beginnings Online Pre-pilot was to assist a group of skilled professionals before landing to become fully prepared to effectively search for work in Canada. Over the four month period of the project, the three workshops of the New Beginnings Online Program were delivered to a group of participants who had been approved to immigrate to Canada either through the federal Skilled Worker Program or a Provincial Nominee Program. The workshops included the Job Search Workshop, Interview Skills Workshop and the Working in Canada Workshop.",http://www.isans.ca,,Restricted,NA,Provincial,2008,Any / All
285,ISANS,research,Working with Immigrants Beyond HRM,"This report is a description of a project. The Nova Scotia Distance Workplace Skills Initiative was a nine-month project (September 2006-May  2007) funded by Human Resources and Skills Development Canada and delivered by Metropolitan Immigrant Settlement Association (MISA) and Halifax Immigrant Learning Centre (HILC). This project was intended to develop a framework for services to immigrants in Nova Scotia outside the Halifax Regional Municipality (HRM), in collaboration with local communities. The focus was to be on language, workplace skills, and business support.",http://www.isans.ca,,Restricted,NA,Provincial,2007,Any / All
286,Department of Labour and Advanced Education,products,Outlooks Methodology,"Employment outlooks are displayed on Explore Careers, where possible, for each occupation. Occupations receive an outlook of either Good, Average, Limited, or Undetermined.",https://explorecareers.novascotia.ca/outlooks-methodology,,OPEN,,Varies,,NA
287,Department of Labour and Advanced Education,products,Occupational Profile Sources,"Provides the source, update frequency, and date last updated for each data point found in the occupational profile.",https://explorecareers.novascotia.ca/sources,,OPEN,NA,Varies,,NA
288,Department of Labour and Advanced Education,products,Guide to Understanding Labour Market Information (LMI),"This guide was created to help you to understand Labour Market Information (LMI). You will learn how to find and use LMI to make good decisions about your education, your career, your workplace, your community, and your life. There is a myriad of information to draw from. With the tips and suggestions in this guide you can use this information to make better choices for yourself.",https://explorecareers.novascotia.ca/sites/default/files/2018-06/16-44875%20Labour%20Market%20Info%20English%20SPREADS%20FINAL-s.pdf,,OPEN,,N/A,,Any / All
289,Department of Labour and Advanced Education,products,Wage Methodology,"Information on how wages are displayed and calculated, and other frequently asked questions about wages.",https://explorecareers.novascotia.ca/wage-methodology,,OPEN,,"Industry, Occupation",,NA
290,Department of Labour and Advanced Education,products,Compare Jobs,Compare up to five occupations.,https://explorecareers.novascotia.ca/compareoccupations,,open,NA,"Business, Individual",,NA
291,Department of Labour and Advanced Education,products,Education,Search for a post-secondary education program.,https://explorecareers.novascotia.ca/educationandtraining,,OPEN,,Varies,,Any / All
292,Department of Labour and Advanced Education,products,Labour Market Information,Information on Nova Scotia's labour market.,https://explorecareers.novascotia.ca/labourmarketinformation,,Open,,Varies,,NA
299,Maritime Provinces Higher Education Commission,primary,Graduate Follow-up Survey,"Survey that has been conducted beginning in 1995. The commission survey every 4th cohort with follow-ups at 2 and 5 years after graduation. The purpose of the study is to look at outcomes and perceptions of post-secondary studies from the perspective of the graduates. The survey looks at employment outcomes, migration, debt , etc. Surveys have had between 3000-4200 respondents.",http://www.mphec.ca/research/graduatefollowupsurveys.aspx,,Open,Every 2-5 yrs,Industry,NA,Any / All
300,Maritime Provinces Higher Education Commission,primary,Maritime University Statistics (PSIS),"An enrolment database that collects data generated using PSIS from all the publicly funded Universities in the Maritimes. The PSIS data is collected and analyzed.  The data collected pertains to student information such as; degrees granted, majors underway and so on.",http://www.mphec.ca/research/maritimeuniversitystatistics.aspx,,Open,Annually,Industry,NA,Any / All
301,Maritime Provinces Higher Education Commission,products,Measures of Student Progress and Outcomes,"This is modular product with each module consisting of a set of measures grouped to inform a single policy theme. Each module or set of measures is released separately along with a document providing context and policy implications. Taken together, the modules inform the broader project theme of student progress and outcomes.",http://www.mphec.ca/research/measuresstudentprogressoutcomes.aspx,,Open,Annually,Varies by publication,NA,Any / All
302,Maritime Provinces Higher Education Commission,products,Trends in Maritime Higher Education,"The Trends in Maritime Higher Education publication, is an occasional series of focused analysis, ranging from four to sixteen pages, prepared by the Maritime Provinces Higher Education Commission staff. Topics include; Student Progression within University of first Entry: Persistence and Graduation, University Participation: A Maritime Perspective, Outcomes of Rural and Urban Maritime University Graduates, and more.",http://www.mphec.ca/research/trendsmaritimehighereducation.aspx,,Open,Periodical,Varies by publication,NA,Any / All
303,Maritime Provinces Higher Education Commission,research,Intentions of Maritime University Students Following Graduation: A Survey of Class of 2007,"A survey providing information on attitudes toward, and plans for, pursuing further education, as well as preparedness for further studies and the workforce. The study also provides important information on student debt at graduation.",http://www.mphec.ca/research/IntentionsUniversityGraduates.aspx,,Open,Periodical,Provincial,2008,Any / All
305,Maritime Provinces Higher Education Commission,research,Presentations and Publications on Higher Education in the Maritimes,Provides insights on higher education in the Maritime provinces,http://www.mphec.ca/presentationsandpublications/presentationsandpublications.aspx,"Educators, Academics, Students, Government, Policymakers",Open,Annually,"Provincial, Regional",NA,Youth
308,Merit Contractors Association of Nova Scotia,products,Merit Contractors Association of Nova Scotia,Specific goals of the Association and its members are to promote safe healthy working conditions and to ensure fair representation to employees and employers in Nova Scotia.,http://www.meritns.com/,,OPEN,,Provincial,,Any / All
309,Midwifery Coalition of Nova Scotia,products,Midwifery Coalition of Nova Scotia,"The Midwifery Coalition is a consumer group. For over 20 years, the Midwifery Coalition of Nova Scotia has been working to have midwifery accepted as a regulated health profession.",http://www.chebucto.ns.ca/health/Midwifery/,,open,,Provincial,,Any / All
310,Mining Industry Human Resources Council,products,Mining Industry Human Resources Council,"MiHR contributes to the strength, competitiveness, and sustainability of the Canadian mining industry by leading the collaboration among communities of interest to address emerging human resources opportunities and challenges.",https://www.mihr.ca/,,OPEN,,Regional,,Any / All
311,Motor Carrier Passenger Council of Canada,products,Motor Carrier Passenger Council of Canada,"Our focus is identifying and addressing human resources issues within the motor carrier passenger industry.  Our efforts are focused on providing new and better services for all passengers, from -students to seniors, from commuters to those with special needs.",http://www.buscouncil.ca/,,OPEN,,Regional,,Any / All
312,Music Nova Scotia,products,Music Nova Scotia,"Music Nova Scotia is a non-profit organization that has worked since 1989 with a mandate to encourage the creation, development, growth, and promotion of Nova Scotia's music industry.",http://www.musicnovascotia.ca/,,Restricted,,Provincial,,Any / All
314,Nova Scotia Association of Medical Radiation Technologists,products,Nova Scotia Association of Medical Radiation Technologies,The Nova Scotia Association of Medical Radiation Technologists (NSAMRT) represents over 500 members in Nova Scotia in various fields of medical radiation technology.,http://nsamrt.ca/,,OPEN,,Provincial,,NA
315,Nova Scotia Association of Optometrists,products,Nova Scotia Association of Optometrists,Our mission is to foster excellence in the delivery of vision and eye health services in Nova Scotia.,http://www.nsoptometrists.ca/,,Restricted,,Provincial,,NA
316,Nova Scotia Association of Realtors,products,Nova Scotia Association of Realtors,The Association's mission is to enhance REALTERS® success by providing services and representation to enable them to best serve the public in real estate transactions.  The Association also acts as the voice for real estate in Nova Scotia.,https://www.nsrealtors.ca/,,OPEN,,Provincial,,NA
317,Nova Scotia Association of Social Workers,products,Nova Scotia College of Social Workers,The Nova Scotia College of Social Workers exists to serve and protect Nova Scotians by effectively regulating the profession of social work.,http://nscsw.org/,,Restricted,,Provincial,,NA
318,Nova Scotia Automobile Dealers Association,products,Nova Scotia Automobile Dealers Association,"To assist and protect its member dealers in those situations where their individual actions are ineffective and where collective, united action is required to bring about desirable results.",http://www.nsada.ca/,,Restricted,,Provincial,,Any / All
319,Nova Scotia Barrister's Society,products,Nova Scotia Barrister's Society,"Acting in the public interest, we provide leadership, value and support to a competent, ethical, inclusive and engaged legal profession.",http://www.nsbs.org/,,OPEN,,Provincial,,NA
321,Nova Scotia Boat Builders Association,primary,Economic Sector Impact,"Poll members on an annual basis. The surveys look at number of employees, gross sales, etc. The data is collected for providing outcomes to funding partners.",https://nsboats.com/,,Restricted,Annually,Business,NA,Any / All
322,Nova Scotia Boat Builders Association,primary,Training Tracking database,"Training is provided to anyone in the boat building and recreational marine sector. It is not limited to NSBA members. Training is provided for employers, management, employees. The purpose of training could be for certification or skills upgrading purposes.",https://nsboats.com/,,Restricted,,Industry,NA,Any / All
323,Nova Scotia Boat Builders Association,products,News,"One page newsletter with current topical information provided. Information on the boat building industry including recent launches, new developments/technologies, training and jobs available.",https://nsboats.com/public-news/,,Open,Periodical,Industry,NA,Any / All
324,Nova Scotia Boat Builders Association,products,Job seeker website,Job seeker section for both employers and job seekers.,https://nsboats.com/employment-opportunities/,,Open,NA,Business,NA,Any / All
325,Nova Scotia Boat Builders Association,products,Nova Scotia Boat Builders Association,NSBA's mission is to create and foster an environment that promotes profitable and sustained export-oriented business growth for its members.,https://nsboats.com/,,Restricted,,Provincial,,Any / All
326,Nova Scotia Boat Builders Association,primary,Training Resources,"Training is provided to anyone in the boat building and recreational marine sector. It is not limited to NSBA members. Training is provided for employers, management, employees.",https://nsboats.com/training/,,Restricted,,Industry,NA,Any / All
327,Nova Scotia Building Officials Association,products,Nova Scotia Building Officials of Association,NSBOA represents municipal Building Officials throughout Nova Scotia. The association has 100 members from all regions of the province. Membership is organized by Zone.,http://www.nsboa.ca/,,open,,Provincial,,Any / All
329,Nova Scotia Career Development Association,products,Professional Development for Career Development Professionals,"Enable regional career practitioners to share career development resources and ""best practice"" information that comes from local, provincial and national organizations.",http://nscda.ca/index.php,,Open,NA,Business,NA,NA
331,Nova Scotia College of Dispensing Opticians,products,Nova Scotia College of Dispensing Opticians,The Nova Scotia College of Dispensing Opticians is the health regulatory college for all Opticians in Nova Scotia.,http://www.nscdo.ca/,,open,,Provincial,,NA
332,Nova Scotia College of Medical Laboratory Technologists,products,Nova Scotia College of Medical Laboratory Technologists,"To protect public safety through regulation, education, advocacy and leadership in Medical Laboratory Science.",http://www.nscmlt.org/,,open,,Provincial,,NA
333,Nova Scotia College of Optometrists,products,Nova Scotia College of Optometrists,The Nova Scotia College of Optometrists (NSCO) is the self-regulating authority accountable for registering (licensing) and governing optometrists in Nova Scotia.,http://nsco.ca/,,Restricted,,Provincial,,Any / All
334,Nova Scotia College of Pharmacists,products,Nova Scotia College of Pharmacists,Governing the practice of pharmacy in Nova Scotia in the interest of the health and well being of the public.,http://www.nspharmacists.ca/,,open,,Provincial,,NA
335,Nova Scotia College of Physiotherapists,products,Nova Scotia College of Physiotherapists,The Nova Scotia College of Physiotherapists assures that the interests of the public are upheld through the regulation and promotion of competent and ethical physiotherapy services under the Physiotherapy Act.,http://nsphysio.com/,,OPEN,,Provincial,,NA
336,Nova Scotia College of Respiratory Therapists,products,Nova Scotia College of Respiratory Therapists,The Nova Scotia College of Respiratory Therapists (NSCRT) regulates the practice of Respiratory Therapy by setting the standards for the profession and ensuring compliance with provincial acts and related laws.,http://www.nscrt.com/,,OPEN,,Provincial,,NA
337,Nova Scotia Community College,products,1 year Graduate Follow-Up Survey,"Looks at the supply side information of the graduates of the NSCC. They look at: General Employment Outcomes, Sector Specific Employment Outcomes, Voluntary Contributions to the community by graduates, Portfolio Satisfaction. Can be linked to occupational projections/ NOC codes.",https://www.nscc.ca/about_nscc/publications/index.asp,,Open,Annually,Provincial,NA,Any / All
338,Nova Scotia Community College,research,5 Year longitudinal study 2007-2012,"This is a longitudinal study of NSCC and NS University grads employment outcomes for students with disabilities. They report on their thoughts on their educational experience, reflections on success with transition from learning to work. Every year a report has been generated. 2006 and 2007 have been published. NSCC is inputting their research into a web-based instrument for collecting data. They are using in-house software for managing data.",http://www.nscc.ca,,Restricted,Ongoing,Provincial,2007,Any / All
340,BuildForce Canada,primary,Labour Market Information - National,"skills required by sector employees, current worker skills and qualifications, demand for additional skills development, current and future essential skills and new technology. Used to establish National Database.",http://www.buildforce.ca/en/catalog/labour-market-information,,Open,Every 2-5 yrs,National,NA,Any / All
341,Nova Scotia Construction Sector Council,primary,Labour Market Information - NS,"skills required by sector employees, current worker skills and qualifications, demand for additional skills development, current and future essential skills and new technology. Used to establish National Database.",http://www.nscsc.ca/,,Open,Every 2-5 yrs,Provincial,NA,Any / All
343,Nova Scotia Dental Association,products,Nova Scotia Dental Association,The NSDA represents the dentists of Nova Scotia.,http://www.nsdental.org/,,OPEN,,Provincial,,Any / All
